,NFATC2 human tf ARCHS4 coexpression,NFATC2 human,NFATC2 mouse,NFATC2,NFATC2 (human),NFATC2 Up,NFATC2 Down,NFATC1 human tf ARCHS4 coexpression,NFATC1 human,NFATC1 mouse,NFATC1,NFATC1 GM12878 hg19,CD2 -> NFATC1 Signaling,FcIgER -> NFATC1 Signaling,TNFRSF5/13B -> NFATC1 Signaling,NFATC1 Up,NFATC1 Down,NFATC1 GM12878,Nfatc1 Sumoylation Autoimmunity Alloreactivity GSE148087 1,Lack Nfatc1 Sumoylation Diseases GSE119313 1
NFATC2 human tf ARCHS4 coexpression,0,0,"<div class = ""df-wrap"" style = ""border: 1px solid; font-weight:bold; background-color: Floralwhite; 2px; height: 1.5em; width: 21px; border-radius: 4px; color: black; float: right; text-align: center""><a style = ""text-decoration: none; color: black;"" href = ""/edit/Intersection_Sets/NFATC2_human_tf_ARCHS4_coexpression/NFATC2_mouse.csv"">2</a></div>","<div class = ""df-wrap"" style = ""border: 1px solid; font-weight:bold; background-color: Floralwhite; 2px; height: 1.5em; width: 21px; border-radius: 4px; color: black; float: right; text-align: center""><a style = ""text-decoration: none; color: black;"" href = ""/edit/Intersection_Sets/NFATC2/NFATC2_human_tf_ARCHS4_coexpression.csv"">27</a></div>","<div class = ""df-wrap"" style = ""border: 1px solid; font-weight:bold; background-color: Floralwhite; 2px; height: 1.5em; width: 21px; border-radius: 4px; color: black; float: right; text-align: center""><a style = ""text-decoration: none; color: black;"" href = ""/edit/Intersection_Sets/NFATC2__human_/NFATC2_human_tf_ARCHS4_coexpression.csv"">2</a></div>","<div class = ""df-wrap"" style = ""border: 1px solid; font-weight:bold; background-color: Floralwhite; 2px; height: 1.5em; width: 21px; border-radius: 4px; color: black; float: right; text-align: center""><a style = ""text-decoration: none; color: black;"" href = ""/edit/Intersection_Sets/NFATC2_Up/NFATC2_human_tf_ARCHS4_coexpression.csv"">6</a></div>","<div class = ""df-wrap"" style = ""border: 1px solid; font-weight:bold; background-color: Floralwhite; 2px; height: 1.5em; width: 21px; border-radius: 4px; color: black; float: right; text-align: center""><a style = ""text-decoration: none; color: black;"" href = ""/edit/Intersection_Sets/NFATC2_Down/NFATC2_human_tf_ARCHS4_coexpression.csv"">3</a></div>","<div class = ""df-wrap"" style = ""border: 1px solid; font-weight:bold; background-color: Floralwhite; 2px; height: 1.5em; width: 21px; border-radius: 4px; color: black; float: right; text-align: center""><a style = ""text-decoration: none; color: black;"" href = ""/edit/Intersection_Sets/NFATC1_human_tf_ARCHS4_coexpression/NFATC2_human_tf_ARCHS4_coexpression.csv"">135</a></div>",0,"<div class = ""df-wrap"" style = ""border: 1px solid; font-weight:bold; background-color: Floralwhite; 2px; height: 1.5em; width: 21px; border-radius: 4px; color: black; float: right; text-align: center""><a style = ""text-decoration: none; color: black;"" href = ""/edit/Intersection_Sets/NFATC1_mouse/NFATC2_human_tf_ARCHS4_coexpression.csv"">1</a></div>","<div class = ""df-wrap"" style = ""border: 1px solid; font-weight:bold; background-color: Floralwhite; 2px; height: 1.5em; width: 21px; border-radius: 4px; color: black; float: right; text-align: center""><a style = ""text-decoration: none; color: black;"" href = ""/edit/Intersection_Sets/NFATC1/NFATC2_human_tf_ARCHS4_coexpression.csv"">24</a></div>","<div class = ""df-wrap"" style = ""border: 1px solid; font-weight:bold; background-color: Floralwhite; 2px; height: 1.5em; width: 21px; border-radius: 4px; color: black; float: right; text-align: center""><a style = ""text-decoration: none; color: black;"" href = ""/edit/Intersection_Sets/NFATC1_GM12878_hg19/NFATC2_human_tf_ARCHS4_coexpression.csv"">27</a></div>","<div class = ""df-wrap"" style = ""border: 1px solid; font-weight:bold; background-color: Floralwhite; 2px; height: 1.5em; width: 21px; border-radius: 4px; color: black; float: right; text-align: center""><a style = ""text-decoration: none; color: black;"" href = ""/edit/Intersection_Sets/CD2_-__NFATC1_Signaling/NFATC2_human_tf_ARCHS4_coexpression.csv"">6</a></div>","<div class = ""df-wrap"" style = ""border: 1px solid; font-weight:bold; background-color: Floralwhite; 2px; height: 1.5em; width: 21px; border-radius: 4px; color: black; float: right; text-align: center""><a style = ""text-decoration: none; color: black;"" href = ""/edit/Intersection_Sets/FcIgER_-__NFATC1_Signaling/NFATC2_human_tf_ARCHS4_coexpression.csv"">5</a></div>","<div class = ""df-wrap"" style = ""border: 1px solid; font-weight:bold; background-color: Floralwhite; 2px; height: 1.5em; width: 21px; border-radius: 4px; color: black; float: right; text-align: center""><a style = ""text-decoration: none; color: black;"" href = ""/edit/Intersection_Sets/NFATC2_human_tf_ARCHS4_coexpression/TNFRSF5_13B_-__NFATC1_Signaling.csv"">1</a></div>","<div class = ""df-wrap"" style = ""border: 1px solid; font-weight:bold; background-color: Floralwhite; 2px; height: 1.5em; width: 21px; border-radius: 4px; color: black; float: right; text-align: center""><a style = ""text-decoration: none; color: black;"" href = ""/edit/Intersection_Sets/NFATC1_Up/NFATC2_human_tf_ARCHS4_coexpression.csv"">9</a></div>","<div class = ""df-wrap"" style = ""border: 1px solid; font-weight:bold; background-color: Floralwhite; 2px; height: 1.5em; width: 21px; border-radius: 4px; color: black; float: right; text-align: center""><a style = ""text-decoration: none; color: black;"" href = ""/edit/Intersection_Sets/NFATC1_Down/NFATC2_human_tf_ARCHS4_coexpression.csv"">2</a></div>","<div class = ""df-wrap"" style = ""border: 1px solid; font-weight:bold; background-color: Floralwhite; 2px; height: 1.5em; width: 21px; border-radius: 4px; color: black; float: right; text-align: center""><a style = ""text-decoration: none; color: black;"" href = ""/edit/Intersection_Sets/NFATC1_GM12878/NFATC2_human_tf_ARCHS4_coexpression.csv"">81</a></div>","<div class = ""df-wrap"" style = ""border: 1px solid; font-weight:bold; background-color: Floralwhite; 2px; height: 1.5em; width: 21px; border-radius: 4px; color: black; float: right; text-align: center""><a style = ""text-decoration: none; color: black;"" href = ""/edit/Intersection_Sets/NFATC2_human_tf_ARCHS4_coexpression/Nfatc1_Sumoylation_Autoimmunity_Alloreactivity_GSE148087_1.csv"">3</a></div>","<div class = ""df-wrap"" style = ""border: 1px solid; font-weight:bold; background-color: Floralwhite; 2px; height: 1.5em; width: 21px; border-radius: 4px; color: black; float: right; text-align: center""><a style = ""text-decoration: none; color: black;"" href = ""/edit/Intersection_Sets/Lack_Nfatc1_Sumoylation_Diseases_GSE119313_1/NFATC2_human_tf_ARCHS4_coexpression.csv"">1</a></div>"
NFATC2 human,0,0,"<div class = ""df-wrap"" style = ""border: 1px solid; font-weight:bold; background-color: Floralwhite; 2px; height: 1.5em; width: 21px; border-radius: 4px; color: black; float: right; text-align: center""><a style = ""text-decoration: none; color: black;"" href = ""/edit/Intersection_Sets/NFATC2_human/NFATC2_mouse.csv"">2</a></div>","<div class = ""df-wrap"" style = ""border: 1px solid; font-weight:bold; background-color: Floralwhite; 2px; height: 1.5em; width: 21px; border-radius: 4px; color: black; float: right; text-align: center""><a style = ""text-decoration: none; color: black;"" href = ""/edit/Intersection_Sets/NFATC2/NFATC2_human.csv"">1</a></div>","<div class = ""df-wrap"" style = ""border: 1px solid; font-weight:bold; background-color: Floralwhite; 2px; height: 1.5em; width: 21px; border-radius: 4px; color: black; float: right; text-align: center""><a style = ""text-decoration: none; color: black;"" href = ""/edit/Intersection_Sets/NFATC2__human_/NFATC2_human.csv"">1</a></div>",0,0,0,"<div class = ""df-wrap"" style = ""border: 1px solid; font-weight:bold; background-color: Floralwhite; 2px; height: 1.5em; width: 21px; border-radius: 4px; color: black; float: right; text-align: center""><a style = ""text-decoration: none; color: black;"" href = ""/edit/Intersection_Sets/NFATC1_human/NFATC2_human.csv"">3</a></div>","<div class = ""df-wrap"" style = ""border: 1px solid; font-weight:bold; background-color: Floralwhite; 2px; height: 1.5em; width: 21px; border-radius: 4px; color: black; float: right; text-align: center""><a style = ""text-decoration: none; color: black;"" href = ""/edit/Intersection_Sets/NFATC1_mouse/NFATC2_human.csv"">1</a></div>","<div class = ""df-wrap"" style = ""border: 1px solid; font-weight:bold; background-color: Floralwhite; 2px; height: 1.5em; width: 21px; border-radius: 4px; color: black; float: right; text-align: center""><a style = ""text-decoration: none; color: black;"" href = ""/edit/Intersection_Sets/NFATC1/NFATC2_human.csv"">1</a></div>",0,0,0,0,0,0,"<div class = ""df-wrap"" style = ""border: 1px solid; font-weight:bold; background-color: Floralwhite; 2px; height: 1.5em; width: 21px; border-radius: 4px; color: black; float: right; text-align: center""><a style = ""text-decoration: none; color: black;"" href = ""/edit/Intersection_Sets/NFATC1_GM12878/NFATC2_human.csv"">2</a></div>",0,0
NFATC2 mouse,"<div class = ""df-wrap"" style = ""border: 1px solid; font-weight:bold; background-color: Floralwhite;  height: 1.5em; width: 21px; border-radius: 4px; color: black; float: right; text-align: center""><a style = ""text-decoration: none; color: black;"" href = ""/edit/Intersection_Sets/NFATC2_human_tf_ARCHS4_coexpression/NFATC2_mouse.csv"">2</a></div>","<div class = ""df-wrap"" style = ""border: 1px solid; font-weight:bold; background-color: Floralwhite;  height: 1.5em; width: 21px; border-radius: 4px; color: black; float: right; text-align: center""><a style = ""text-decoration: none; color: black;"" href = ""/edit/Intersection_Sets/NFATC2_human/NFATC2_mouse.csv"">2</a></div>",0,"<div class = ""df-wrap"" style = ""border: 1px solid; font-weight:bold; background-color: Floralwhite; 2px; height: 1.5em; width: 21px; border-radius: 4px; color: black; float: right; text-align: center""><a style = ""text-decoration: none; color: black;"" href = ""/edit/Intersection_Sets/NFATC2/NFATC2_mouse.csv"">2</a></div>","<div class = ""df-wrap"" style = ""border: 1px solid; font-weight:bold; background-color: Floralwhite; 2px; height: 1.5em; width: 21px; border-radius: 4px; color: black; float: right; text-align: center""><a style = ""text-decoration: none; color: black;"" href = ""/edit/Intersection_Sets/NFATC2__human_/NFATC2_mouse.csv"">4</a></div>","<div class = ""df-wrap"" style = ""border: 1px solid; font-weight:bold; background-color: Floralwhite; 2px; height: 1.5em; width: 21px; border-radius: 4px; color: black; float: right; text-align: center""><a style = ""text-decoration: none; color: black;"" href = ""/edit/Intersection_Sets/NFATC2_Up/NFATC2_mouse.csv"">1</a></div>",0,0,"<div class = ""df-wrap"" style = ""border: 1px solid; font-weight:bold; background-color: Floralwhite; 2px; height: 1.5em; width: 21px; border-radius: 4px; color: black; float: right; text-align: center""><a style = ""text-decoration: none; color: black;"" href = ""/edit/Intersection_Sets/NFATC1_human/NFATC2_mouse.csv"">3</a></div>","<div class = ""df-wrap"" style = ""border: 1px solid; font-weight:bold; background-color: Floralwhite; 2px; height: 1.5em; width: 21px; border-radius: 4px; color: black; float: right; text-align: center""><a style = ""text-decoration: none; color: black;"" href = ""/edit/Intersection_Sets/NFATC1_mouse/NFATC2_mouse.csv"">6</a></div>","<div class = ""df-wrap"" style = ""border: 1px solid; font-weight:bold; background-color: Floralwhite; 2px; height: 1.5em; width: 21px; border-radius: 4px; color: black; float: right; text-align: center""><a style = ""text-decoration: none; color: black;"" href = ""/edit/Intersection_Sets/NFATC1/NFATC2_mouse.csv"">1</a></div>",0,"<div class = ""df-wrap"" style = ""border: 1px solid; font-weight:bold; background-color: Floralwhite; 2px; height: 1.5em; width: 21px; border-radius: 4px; color: black; float: right; text-align: center""><a style = ""text-decoration: none; color: black;"" href = ""/edit/Intersection_Sets/CD2_-__NFATC1_Signaling/NFATC2_mouse.csv"">1</a></div>","<div class = ""df-wrap"" style = ""border: 1px solid; font-weight:bold; background-color: Floralwhite; 2px; height: 1.5em; width: 21px; border-radius: 4px; color: black; float: right; text-align: center""><a style = ""text-decoration: none; color: black;"" href = ""/edit/Intersection_Sets/FcIgER_-__NFATC1_Signaling/NFATC2_mouse.csv"">1</a></div>","<div class = ""df-wrap"" style = ""border: 1px solid; font-weight:bold; background-color: Floralwhite; 2px; height: 1.5em; width: 21px; border-radius: 4px; color: black; float: right; text-align: center""><a style = ""text-decoration: none; color: black;"" href = ""/edit/Intersection_Sets/NFATC2_mouse/TNFRSF5_13B_-__NFATC1_Signaling.csv"">1</a></div>","<div class = ""df-wrap"" style = ""border: 1px solid; font-weight:bold; background-color: Floralwhite; 2px; height: 1.5em; width: 21px; border-radius: 4px; color: black; float: right; text-align: center""><a style = ""text-decoration: none; color: black;"" href = ""/edit/Intersection_Sets/NFATC1_Up/NFATC2_mouse.csv"">1</a></div>","<div class = ""df-wrap"" style = ""border: 1px solid; font-weight:bold; background-color: Floralwhite; 2px; height: 1.5em; width: 21px; border-radius: 4px; color: black; float: right; text-align: center""><a style = ""text-decoration: none; color: black;"" href = ""/edit/Intersection_Sets/NFATC1_Down/NFATC2_mouse.csv"">1</a></div>","<div class = ""df-wrap"" style = ""border: 1px solid; font-weight:bold; background-color: Floralwhite; 2px; height: 1.5em; width: 21px; border-radius: 4px; color: black; float: right; text-align: center""><a style = ""text-decoration: none; color: black;"" href = ""/edit/Intersection_Sets/NFATC1_GM12878/NFATC2_mouse.csv"">1</a></div>",0,0
NFATC2,"<div class = ""df-wrap"" style = ""border: 1px solid; font-weight:bold; background-color: Floralwhite;  height: 1.5em; width: 21px; border-radius: 4px; color: black; float: right; text-align: center""><a style = ""text-decoration: none; color: black;"" href = ""/edit/Intersection_Sets/NFATC2/NFATC2_human_tf_ARCHS4_coexpression.csv"">27</a></div>","<div class = ""df-wrap"" style = ""border: 1px solid; font-weight:bold; background-color: Floralwhite;  height: 1.5em; width: 21px; border-radius: 4px; color: black; float: right; text-align: center""><a style = ""text-decoration: none; color: black;"" href = ""/edit/Intersection_Sets/NFATC2/NFATC2_human.csv"">1</a></div>","<div class = ""df-wrap"" style = ""border: 1px solid; font-weight:bold; background-color: Floralwhite;  height: 1.5em; width: 21px; border-radius: 4px; color: black; float: right; text-align: center""><a style = ""text-decoration: none; color: black;"" href = ""/edit/Intersection_Sets/NFATC2/NFATC2_mouse.csv"">2</a></div>",0,"<div class = ""df-wrap"" style = ""border: 1px solid; font-weight:bold; background-color: Floralwhite; 2px; height: 1.5em; width: 21px; border-radius: 4px; color: black; float: right; text-align: center""><a style = ""text-decoration: none; color: black;"" href = ""/edit/Intersection_Sets/NFATC2/NFATC2__human_.csv"">5</a></div>","<div class = ""df-wrap"" style = ""border: 1px solid; font-weight:bold; background-color: Floralwhite; 2px; height: 1.5em; width: 21px; border-radius: 4px; color: black; float: right; text-align: center""><a style = ""text-decoration: none; color: black;"" href = ""/edit/Intersection_Sets/NFATC2/NFATC2_Up.csv"">11</a></div>","<div class = ""df-wrap"" style = ""border: 1px solid; font-weight:bold; background-color: Floralwhite; 2px; height: 1.5em; width: 21px; border-radius: 4px; color: black; float: right; text-align: center""><a style = ""text-decoration: none; color: black;"" href = ""/edit/Intersection_Sets/NFATC2/NFATC2_Down.csv"">17</a></div>","<div class = ""df-wrap"" style = ""border: 1px solid; font-weight:bold; background-color: Floralwhite; 2px; height: 1.5em; width: 21px; border-radius: 4px; color: black; float: right; text-align: center""><a style = ""text-decoration: none; color: black;"" href = ""/edit/Intersection_Sets/NFATC1_human_tf_ARCHS4_coexpression/NFATC2.csv"">22</a></div>","<div class = ""df-wrap"" style = ""border: 1px solid; font-weight:bold; background-color: Floralwhite; 2px; height: 1.5em; width: 21px; border-radius: 4px; color: black; float: right; text-align: center""><a style = ""text-decoration: none; color: black;"" href = ""/edit/Intersection_Sets/NFATC1_human/NFATC2.csv"">2</a></div>","<div class = ""df-wrap"" style = ""border: 1px solid; font-weight:bold; background-color: Floralwhite; 2px; height: 1.5em; width: 21px; border-radius: 4px; color: black; float: right; text-align: center""><a style = ""text-decoration: none; color: black;"" href = ""/edit/Intersection_Sets/NFATC1_mouse/NFATC2.csv"">2</a></div>","<div class = ""df-wrap"" style = ""border: 1px solid; font-weight:bold; background-color: Floralwhite; 2px; height: 1.5em; width: 21px; border-radius: 4px; color: black; float: right; text-align: center""><a style = ""text-decoration: none; color: black;"" href = ""/edit/Intersection_Sets/NFATC1/NFATC2.csv"">207</a></div>","<div class = ""df-wrap"" style = ""border: 1px solid; font-weight:bold; background-color: Floralwhite; 2px; height: 1.5em; width: 21px; border-radius: 4px; color: black; float: right; text-align: center""><a style = ""text-decoration: none; color: black;"" href = ""/edit/Intersection_Sets/NFATC1_GM12878_hg19/NFATC2.csv"">16</a></div>","<div class = ""df-wrap"" style = ""border: 1px solid; font-weight:bold; background-color: Floralwhite; 2px; height: 1.5em; width: 21px; border-radius: 4px; color: black; float: right; text-align: center""><a style = ""text-decoration: none; color: black;"" href = ""/edit/Intersection_Sets/CD2_-__NFATC1_Signaling/NFATC2.csv"">2</a></div>","<div class = ""df-wrap"" style = ""border: 1px solid; font-weight:bold; background-color: Floralwhite; 2px; height: 1.5em; width: 21px; border-radius: 4px; color: black; float: right; text-align: center""><a style = ""text-decoration: none; color: black;"" href = ""/edit/Intersection_Sets/FcIgER_-__NFATC1_Signaling/NFATC2.csv"">1</a></div>","<div class = ""df-wrap"" style = ""border: 1px solid; font-weight:bold; background-color: Floralwhite; 2px; height: 1.5em; width: 21px; border-radius: 4px; color: black; float: right; text-align: center""><a style = ""text-decoration: none; color: black;"" href = ""/edit/Intersection_Sets/NFATC2/TNFRSF5_13B_-__NFATC1_Signaling.csv"">2</a></div>","<div class = ""df-wrap"" style = ""border: 1px solid; font-weight:bold; background-color: Floralwhite; 2px; height: 1.5em; width: 21px; border-radius: 4px; color: black; float: right; text-align: center""><a style = ""text-decoration: none; color: black;"" href = ""/edit/Intersection_Sets/NFATC1_Up/NFATC2.csv"">17</a></div>","<div class = ""df-wrap"" style = ""border: 1px solid; font-weight:bold; background-color: Floralwhite; 2px; height: 1.5em; width: 21px; border-radius: 4px; color: black; float: right; text-align: center""><a style = ""text-decoration: none; color: black;"" href = ""/edit/Intersection_Sets/NFATC1_Down/NFATC2.csv"">15</a></div>","<div class = ""df-wrap"" style = ""border: 1px solid; font-weight:bold; background-color: Floralwhite; 2px; height: 1.5em; width: 21px; border-radius: 4px; color: black; float: right; text-align: center""><a style = ""text-decoration: none; color: black;"" href = ""/edit/Intersection_Sets/NFATC1_GM12878/NFATC2.csv"">43</a></div>","<div class = ""df-wrap"" style = ""border: 1px solid; font-weight:bold; background-color: Floralwhite; 2px; height: 1.5em; width: 21px; border-radius: 4px; color: black; float: right; text-align: center""><a style = ""text-decoration: none; color: black;"" href = ""/edit/Intersection_Sets/NFATC2/Nfatc1_Sumoylation_Autoimmunity_Alloreactivity_GSE148087_1.csv"">4</a></div>","<div class = ""df-wrap"" style = ""border: 1px solid; font-weight:bold; background-color: Floralwhite; 2px; height: 1.5em; width: 21px; border-radius: 4px; color: black; float: right; text-align: center""><a style = ""text-decoration: none; color: black;"" href = ""/edit/Intersection_Sets/Lack_Nfatc1_Sumoylation_Diseases_GSE119313_1/NFATC2.csv"">9</a></div>"
NFATC2 (human),"<div class = ""df-wrap"" style = ""border: 1px solid; font-weight:bold; background-color: Floralwhite;  height: 1.5em; width: 21px; border-radius: 4px; color: black; float: right; text-align: center""><a style = ""text-decoration: none; color: black;"" href = ""/edit/Intersection_Sets/NFATC2__human_/NFATC2_human_tf_ARCHS4_coexpression.csv"">2</a></div>","<div class = ""df-wrap"" style = ""border: 1px solid; font-weight:bold; background-color: Floralwhite;  height: 1.5em; width: 21px; border-radius: 4px; color: black; float: right; text-align: center""><a style = ""text-decoration: none; color: black;"" href = ""/edit/Intersection_Sets/NFATC2__human_/NFATC2_human.csv"">1</a></div>","<div class = ""df-wrap"" style = ""border: 1px solid; font-weight:bold; background-color: Floralwhite;  height: 1.5em; width: 21px; border-radius: 4px; color: black; float: right; text-align: center""><a style = ""text-decoration: none; color: black;"" href = ""/edit/Intersection_Sets/NFATC2__human_/NFATC2_mouse.csv"">4</a></div>","<div class = ""df-wrap"" style = ""border: 1px solid; font-weight:bold; background-color: Floralwhite;  height: 1.5em; width: 21px; border-radius: 4px; color: black; float: right; text-align: center""><a style = ""text-decoration: none; color: black;"" href = ""/edit/Intersection_Sets/NFATC2/NFATC2__human_.csv"">5</a></div>",0,"<div class = ""df-wrap"" style = ""border: 1px solid; font-weight:bold; background-color: Floralwhite; 2px; height: 1.5em; width: 21px; border-radius: 4px; color: black; float: right; text-align: center""><a style = ""text-decoration: none; color: black;"" href = ""/edit/Intersection_Sets/NFATC2_Up/NFATC2__human_.csv"">3</a></div>","<div class = ""df-wrap"" style = ""border: 1px solid; font-weight:bold; background-color: Floralwhite; 2px; height: 1.5em; width: 21px; border-radius: 4px; color: black; float: right; text-align: center""><a style = ""text-decoration: none; color: black;"" href = ""/edit/Intersection_Sets/NFATC2_Down/NFATC2__human_.csv"">2</a></div>","<div class = ""df-wrap"" style = ""border: 1px solid; font-weight:bold; background-color: Floralwhite; 2px; height: 1.5em; width: 21px; border-radius: 4px; color: black; float: right; text-align: center""><a style = ""text-decoration: none; color: black;"" href = ""/edit/Intersection_Sets/NFATC1_human_tf_ARCHS4_coexpression/NFATC2__human_.csv"">3</a></div>","<div class = ""df-wrap"" style = ""border: 1px solid; font-weight:bold; background-color: Floralwhite; 2px; height: 1.5em; width: 21px; border-radius: 4px; color: black; float: right; text-align: center""><a style = ""text-decoration: none; color: black;"" href = ""/edit/Intersection_Sets/NFATC1_human/NFATC2__human_.csv"">2</a></div>","<div class = ""df-wrap"" style = ""border: 1px solid; font-weight:bold; background-color: Floralwhite; 2px; height: 1.5em; width: 21px; border-radius: 4px; color: black; float: right; text-align: center""><a style = ""text-decoration: none; color: black;"" href = ""/edit/Intersection_Sets/NFATC1_mouse/NFATC2__human_.csv"">3</a></div>","<div class = ""df-wrap"" style = ""border: 1px solid; font-weight:bold; background-color: Floralwhite; 2px; height: 1.5em; width: 21px; border-radius: 4px; color: black; float: right; text-align: center""><a style = ""text-decoration: none; color: black;"" href = ""/edit/Intersection_Sets/NFATC1/NFATC2__human_.csv"">6</a></div>","<div class = ""df-wrap"" style = ""border: 1px solid; font-weight:bold; background-color: Floralwhite; 2px; height: 1.5em; width: 21px; border-radius: 4px; color: black; float: right; text-align: center""><a style = ""text-decoration: none; color: black;"" href = ""/edit/Intersection_Sets/NFATC1_GM12878_hg19/NFATC2__human_.csv"">11</a></div>",0,0,"<div class = ""df-wrap"" style = ""border: 1px solid; font-weight:bold; background-color: Floralwhite; 2px; height: 1.5em; width: 21px; border-radius: 4px; color: black; float: right; text-align: center""><a style = ""text-decoration: none; color: black;"" href = ""/edit/Intersection_Sets/NFATC2__human_/TNFRSF5_13B_-__NFATC1_Signaling.csv"">1</a></div>","<div class = ""df-wrap"" style = ""border: 1px solid; font-weight:bold; background-color: Floralwhite; 2px; height: 1.5em; width: 21px; border-radius: 4px; color: black; float: right; text-align: center""><a style = ""text-decoration: none; color: black;"" href = ""/edit/Intersection_Sets/NFATC1_Up/NFATC2__human_.csv"">3</a></div>","<div class = ""df-wrap"" style = ""border: 1px solid; font-weight:bold; background-color: Floralwhite; 2px; height: 1.5em; width: 21px; border-radius: 4px; color: black; float: right; text-align: center""><a style = ""text-decoration: none; color: black;"" href = ""/edit/Intersection_Sets/NFATC1_Down/NFATC2__human_.csv"">1</a></div>","<div class = ""df-wrap"" style = ""border: 1px solid; font-weight:bold; background-color: Floralwhite; 2px; height: 1.5em; width: 21px; border-radius: 4px; color: black; float: right; text-align: center""><a style = ""text-decoration: none; color: black;"" href = ""/edit/Intersection_Sets/NFATC1_GM12878/NFATC2__human_.csv"">17</a></div>","<div class = ""df-wrap"" style = ""border: 1px solid; font-weight:bold; background-color: Floralwhite; 2px; height: 1.5em; width: 21px; border-radius: 4px; color: black; float: right; text-align: center""><a style = ""text-decoration: none; color: black;"" href = ""/edit/Intersection_Sets/NFATC2__human_/Nfatc1_Sumoylation_Autoimmunity_Alloreactivity_GSE148087_1.csv"">2</a></div>",0
